{
  "$schema": "../../game/schema/world.schema.json",
  "version": 1,
  "name": "Teich am Kreuzweg",
  "rows": [
    "^^^:..:::..,.^__",
    "^^*:.::H:..:..^_",
    "^::..:^+^..:..._",
    ":..,..^+^^.:,...",
    "++++++++++++.:,.",
    ".:,.+~~~~~~+.::.",
    ":.,,+~====~+:..:",
    ".^,.+~====~+.:..",
    "..:.+~====~+.,^.",
    ":..:+~====~+,,.:",
    ".::.+~~~~~~+.,:.",
    ".,:.++++++++++++",
    "...,:.^^+^..,..:",
    "_...:..^+^:..::^",
    "_^..:..:H::.:*^^",
    "__^.,..:::..:^^^"
  ],
  "victory_tiles": [
    { "x": 7, "y": 1 },
    { "x": 8, "y": 14 }
  ]
}
